[
  {
    "evaluationId": "evaluation-pilot-christological",
    "caseId": "institutional-sacrificial-escalation",
    "targetRef": "hyp-institutional-agency",
    "framework": "created-vocation-apostasy-redemption",
    "criteria": [
      "serves created vocation",
      "protects rather than consumes persons",
      "permits truth and correction",
      "does not claim ultimacy",
      "can relinquish power",
      "does not conceal victims"
    ],
    "assessment": "Not yet assessed. The pilot separates this normative question from causal attribution.",
    "causalInferenceProhibited": true,
    "createdBy": "human",
    "reviewStatus": "draft"
  }
]
